[
  {
    "added": [
      "content/markdown/capabilities/allocation.md",
      "content/markdown/capabilities/anomaly-management.md",
      "content/markdown/capabilities/architecting-workload-placement.md",
      "content/markdown/capabilities/automation-tools-services.md",
      "content/markdown/capabilities/budgeting.md",
      "content/markdown/capabilities/data-ingestion.md",
      "content/markdown/capabilities/executive-strategy-alignment.md",
      "content/markdown/capabilities/finops-assessment.md",
      "content/markdown/capabilities/finops-education-enablement.md",
      "content/markdown/capabilities/finops-practice-operations.md",
      "content/markdown/capabilities/forecasting.md",
      "content/markdown/capabilities/governance-policy-risk.md",
      "content/markdown/capabilities/intersecting-disciplines.md",
      "content/markdown/capabilities/invoicing-chargeback.md",
      "content/markdown/capabilities/kpis-benchmarking.md",
      "content/markdown/capabilities/licensing-saas.md",
      "content/markdown/capabilities/planning-estimating.md",
      "content/markdown/capabilities/rate-optimization.md",
      "content/markdown/capabilities/reporting-analytics.md",
      "content/markdown/capabilities/sustainability.md",
      "content/markdown/capabilities/unit-economics.md",
      "content/markdown/capabilities/usage-optimization.md",
      "content/markdown/personas/engineering.md",
      "content/markdown/personas/finance.md",
      "content/markdown/personas/finops-practitioner.md",
      "content/markdown/personas/itam.md",
      "content/markdown/personas/itfm.md",
      "content/markdown/personas/itsm-itil.md",
      "content/markdown/personas/leadership.md",
      "content/markdown/personas/procurement.md",
      "content/markdown/personas/product.md",
      "content/markdown/personas/security.md",
      "content/markdown/personas/sustainability.md",
      "content/markdown/kpis/active-to-provisioned-user-ratio.md",
      "content/markdown/kpis/allocation-accuracy-index-aai.md",
      "content/markdown/kpis/anomaly-detected-carbon-avoidance.md",
      "content/markdown/kpis/anomaly-detected-cost-avoidance.md",
      "content/markdown/kpis/anomaly-detection-rate.md",
      "content/markdown/kpis/auto-scaling-efficiency-rate.md",
      "content/markdown/kpis/cache-hit-rate.md",
      "content/markdown/kpis/carbon-efficient-locations.md",
      "content/markdown/kpis/carbon-per-time-compute-category.md",
      "content/markdown/kpis/carbon-per-time-storage-category.md",
      "content/markdown/kpis/carbon-per-unit-of-cloud-service-sku.md",
      "content/markdown/kpis/carbon-per-unit-of-cloud-spend.md",
      "content/markdown/kpis/carbon-waste-carbon-efficiency.md",
      "content/markdown/kpis/cloud-spend-percentage-of-recurring-revenue.md",
      "content/markdown/kpis/commitment-utilization-score.md",
      "content/markdown/kpis/computational-waste-percentage.md",
      "content/markdown/kpis/consumption-versus-commitment.md",
      "content/markdown/kpis/cost-optimization-index-coin.md",
      "content/markdown/kpis/cost-per-agent-cycle.md",
      "content/markdown/kpis/cost-per-api-call.md",
      "content/markdown/kpis/cost-per-gigabytes-stored.md",
      "content/markdown/kpis/cost-per-inference.md",
      "content/markdown/kpis/cost-per-thought-full-stack.md",
      "content/markdown/kpis/cost-per-thought-llm-only.md",
      "content/markdown/kpis/cost-visibility-delay.md",
      "content/markdown/kpis/count-of-finops-learning-opportunities-offered-monthly-quarterly-annually.md",
      "content/markdown/kpis/cpi-cost-performance-indicator.md",
      "content/markdown/kpis/csp-cloud-budget-burn-rate.md",
      "content/markdown/kpis/csp-cloud-carbon-budget-burn-rate.md",
      "content/markdown/kpis/data-center-management-efficiency.md",
      "content/markdown/kpis/data-center-power-usage-effectiveness.md",
      "content/markdown/kpis/data-value-density.md",
      "content/markdown/kpis/effective-average-compute-cost-per-core.md",
      "content/markdown/kpis/effective-savings-rate-percentage.md",
      "content/markdown/kpis/effective-scan-efficiency.md",
      "content/markdown/kpis/efficiency-performance-roi.md",
      "content/markdown/kpis/etl-processing-time.md",
      "content/markdown/kpis/feature-adoption-rate.md",
      "content/markdown/kpis/fixed-percentage-apportionment-validation.md",
      "content/markdown/kpis/forecast-accuracy-rate-for-carbon-emissions.md",
      "content/markdown/kpis/forecast-accuracy-rate-spend.md",
      "content/markdown/kpis/forecast-accuracy-rate-usage.md",
      "content/markdown/kpis/forecast-drift-rate.md",
      "content/markdown/kpis/forecast-present-actual-rate-carbon.md",
      "content/markdown/kpis/frequency-of-data-updates.md",
      "content/markdown/kpis/general-ledger-recharge-rate.md",
      "content/markdown/kpis/general-ledger-recharge-rate-per-cost-center.md",
      "content/markdown/kpis/hourly-cost-per-cpu-core.md",
      "content/markdown/kpis/it-lifecycle-waste-efficiency.md",
      "content/markdown/kpis/license-utilisation-rate.md",
      "content/markdown/kpis/llm-error-rate.md",
      "content/markdown/kpis/number-of-monthly-active-users-mau-for-cost-insight-products.md",
      "content/markdown/kpis/optimizing-electricity-pue-wue-between-regions-or-cloud-service-providers.md",
      "content/markdown/kpis/percent-of-compute-spend-covered-by-commitment-based-discounts.md",
      "content/markdown/kpis/percent-of-unused-resources.md",
      "content/markdown/kpis/percent-storage-on-frequent-access-tier.md",
      "content/markdown/kpis/percentage-of-carbon-associated-with-untagged-csp-cloud-resources.md",
      "content/markdown/kpis/percentage-of-commitment-based-discount-waste.md",
      "content/markdown/kpis/percentage-of-costs-associated-with-unallocated-csp-cloud-resources.md",
      "content/markdown/kpis/percentage-of-costs-associated-with-untagged-csp-cloud-resources.md",
      "content/markdown/kpis/percentage-of-csp-cloud-carbon-that-is-tagging-policy-compliant.md",
      "content/markdown/kpis/percentage-of-csp-cloud-costs-that-are-tagging-policy-compliant.md",
      "content/markdown/kpis/percentage-of-legacy-resource.md",
      "content/markdown/kpis/percentage-of-normalized-queryable-data-within-repository.md",
      "content/markdown/kpis/percentage-of-stakeholders-all-finops-personas-who-have-completed-finops-training.md",
      "content/markdown/kpis/percentage-of-unallocated-shared-csp-cloud-cost.md",
      "content/markdown/kpis/percentage-resource-utilization.md",
      "content/markdown/kpis/percentage-variance-of-budgeted-vs-actual-csp-cloud-spend.md",
      "content/markdown/kpis/percentage-variance-of-budgeted-vs-forecasted-csp-cloud-spend.md",
      "content/markdown/kpis/pipeline-jobs-waste.md",
      "content/markdown/kpis/power-schedule-adherence-rate.md",
      "content/markdown/kpis/reasoning-token-ratio.md",
      "content/markdown/kpis/redundant-application-coverage-percent.md",
      "content/markdown/kpis/resource-utilization-efficiency.md",
      "content/markdown/kpis/saas-optimization-roi.md",
      "content/markdown/kpis/saas-unit-cost.md",
      "content/markdown/kpis/storage-decay-ratio.md",
      "content/markdown/kpis/thought-efficiency-index-tei.md",
      "content/markdown/kpis/time-to-achieve-business-value.md",
      "content/markdown/kpis/time-to-first-prompt.md",
      "content/markdown/kpis/token-consumption-metrics.md",
      "content/markdown/kpis/total-cost-of-ownership-per-workload.md",
      "content/markdown/kpis/total-migration-cost-savings.md",
      "content/markdown/kpis/total-unpredicted-variance-of-spend.md",
      "content/markdown/kpis/training-cost-efficiency.md",
      "content/markdown/kpis/unified-cost-usage-visibility.md",
      "content/markdown/kpis/usage-or-spend-apportionment-validation.md",
      "content/markdown/kpis/value-for-ai-initiatives.md",
      "content/markdown/principles.md",
      "content/markdown/phases.md",
      "content/markdown/domains.md",
      "content/markdown/maturity-model.md",
      "content/markdown/technology-categories.md",
      "content/markdown/scopes.md"
    ],
    "changed": [],
    "crawled_at": "2026-07-23T01:16:03.012Z",
    "data_version": "2.1.0",
    "removed": [],
    "summary": "127 added, 0 removed, 0 changed"
  },
  {
    "added": [],
    "changed": [],
    "crawled_at": "2026-07-23T01:04:29.065Z",
    "data_version": "2.0.0",
    "removed": [],
    "summary": "0 added, 0 removed, 0 changed"
  },
  {
    "added": [
      "derived/relationships-inferred.json#related:architecting-workload-placement->budgeting#title-mention",
      "derived/relationships-inferred.json#related:architecting-workload-placement->forecasting#title-mention",
      "derived/relationships-inferred.json#related:allocation->data-ingestion#title-mention",
      "derived/relationships-inferred.json#related:executive-strategy-alignment->forecasting#title-mention",
      "derived/relationships-inferred.json#related:executive-strategy-alignment->unit-economics#title-mention",
      "derived/relationships-inferred.json#related:allocation->finops-education-enablement#title-mention",
      "derived/relationships-inferred.json#related:finops-education-enablement->rate-optimization#title-mention",
      "derived/relationships-inferred.json#related:finops-education-enablement->usage-optimization#title-mention",
      "derived/relationships-inferred.json#related:finops-education-enablement->forecasting#title-mention",
      "derived/relationships-inferred.json#related:forecasting->rate-optimization#title-mention",
      "derived/relationships-inferred.json#related:forecasting->usage-optimization#title-mention",
      "derived/relationships-inferred.json#related:forecasting->licensing-saas#title-mention",
      "derived/relationships-inferred.json#related:planning-estimating->rate-optimization#title-mention",